{
  "$schema": "./schemas/archive.schema.json",
  "version": "2.4.0",
  "project": "mekong-cli",
  "_meta": {
    "schemaVersion": "2.4.0",
    "totalArchived": 0,
    "lastArchived": null,
    "oldestTask": null,
    "newestTask": null
  },
  "archivedTasks": [],
  "statistics": {
    "byPhase": {},
    "byPriority": {
      "critical": 0,
      "high": 0,
      "medium": 0,
      "low": 0
    },
    "byLabel": {},
    "averageCycleTime": null
  }
}
